"Data Provider","The Paleobiology Database"
"42142","ref","auth,class","E.","Schellwien","","","","1900","Die Fauna der Trogkofelschichten in den Karnischen Alpen und den Karawanken I. Theil: die Brachiopoden","Abhandlungen der Kaiserlich-Königlichen Geologischen Reichsanstalt","","16","","1","122","journal article","German",""
"34606","ref","auth,class","M.","Schemm-Gregory","","","","2010","Leonispirifer leonensis gen. et sp. nov., a rare delthyridoid spiriferid brachiopod from northern Spain (Brachiopoda, Lower Devonian)","Palaeontologische Zeitschrift","","84","","345","364","journal article","English",""
"44228","ref","auth,class","M.","Schemm-Gregory","M. H.","Henriques","","2012","New data on internal morphology of exceptionally preserved Nannirhynchia pygmaea (Morris, 1847) from the Lusitanian Basin (Brachiopoda, Early Jurassic, Portugal)","Fossil Record","","15","","77","83","journal article","English",""
"26492","ref","auth","O.H.","Schindewolf","","","","1955","Über einige kambrische Guttung inartikulater Brachiopoden","Neues Jahrbuch für Mineralogie, Geologie und Palaeontologie","","12","","538","557","journal article","English",""
"16329","ref","auth","F.","Schmidt","","","","1858","Untersuchungen über die Silurische Formation von Ehstland, Nord-Livland und Oeseland","Archiv für die Naturkunde Livland, Ehstland und Kurlands (1)","","2","","1","248","journal article","German",""
"42670","ref","auth,class","H.","Schmidt","","","","1967","Aratanea monodi n. g., n. sp. (Brachiopoda; W-Sahara)","Senckenbergiana lethaea","","48","2","91","97","journal article","German",""
"63470","ref","auth,class","S.","Schneider","B.","Berning","M. A. Bitner, R. -P. Carriol, M. Jaeger, J. Kriwet, A. Kroh, W. Werner","2009","A parautochthonous shallow marine fauna from the Late Burdigalian\r\n(early Ottnangian) of Gurlarn (Lower Bavaria, SE Germany): Macrofaunal inventory and paleoecology","Neues Jahrbuch für Geologie und Paläontologie","","254","1-2","63","103","journal article","English",""
"63163","ref","class","S.","Schneider","M.","Jäger","A. Kroh, A. Mitterer, B. Niebuhr, R. Vodrážka, M. Wilmsen, C. J. Wood, K.  Zágoršek","2013","Silicified sea life – Macrofauna and palaeoecology of the Neuburg Kieselerde Member (Cenomanian to Lower Turonian Wellheim Formation, Bavaria, southern Germany)","Acta Geologica Polonica","","63","4","555","610","journal article","English",""
"61763","ref","auth,class","S.","Schroeder","V. L.","Leleshus","","2002","First records of Givetian and Frasnian (Devonian) Rugosa from the Pamir Mountains, Tadjikistan","Alcheringa","","26","","127","142","journal article","English",""
"15515","ref","auth","C.","Schuchert","","","","1893","A classification of the Brachiopoda","American Geologist","","11","","141","167","journal article","English",""
"27303","ref","auth","C.","Schuchert","","","","1913","Class 2. Brachiopoda","Text-book of Palaeontology","","1","1","355","420","book/book chapter","English",""
"30444","ref","auth,class","C.","Schuchert","","","","1897","A synopsis of American fossil Brachiopoda","United States Geological Survey Bulletin","","87","","","","serial monograph","English",""
"46252","ref","auth","C.","Schuchert","","","","1913","Systematic paleontology of the Lower Devonian deposits of Maryland; brachiopoda","brachiopoda, Maryland Geological Survey","W. B. Clarke (ed.) Lower Devonian, Maryland Geological Survey","","","290","449","guidebook","English",""
"53174","ref","auth","C.","Schuchert","G. A.","Cooper","","1930","Upper Ordovician and Lower Devonian Stratigraphy and Paleontology of Perce, Quebec; Part 2, New species from the Upper Ordovician of Perce","American Journal of Science","","20","","265","288","journal article","English",""
"53283","ref","auth,class","C.","Schuchert","G. A.","Cooper","","1932","Brachiopod genera of the suborders Orthoidea and Pentameroidea","Memoirs of the Peabody Museum of Natural History","","4","1","1","270","serial monograph","English",""
"48281","ref","auth,class","C.","Schuchert","C. M.","LeVene","","1929","New names for brachiopod homonyms","American Journal of Science, Series 5","","17","","119","122","journal article","English",""
"32236","ref","auth,class","I.","Schülke","","","","1997","Rioultina deisteriensis (Struckmann) from the Heersumer Schichten (Brachiopoda, Thecideidina, Middle Oxfordian, northwestern Germany)","Neues Jahrbuch für Geologie und Paläontologie, Monatshefte","","","8","465","476","journal article","English",""
"32237","ref","auth,class","I.","Schülke","C.","Helm","","2000","A new thecideidinid species (Brachiopoda, Spiriferida) from the Late Jurassic (Oxfordian) of northwestern Germany","Neues Jahrbuch für Geologie und Paläontologie, Monatshefte","","","5","257","270","journal article","English",""
"32227","ref","auth,class","I.","Seifert","","","","1963","Die Brachiopoden des oberen Dogger der Schwäbischen Alb [Brachiopods from the Upper Dogger of the Swabian Alb]","Palaeontographica Abteilung A","","121","","156","203","journal article","German",""
"23388","ref","auth","J.","Seiffert","","","","1975","Upper Jurassic lizards from central Portugal","Contribuição para o conhecimento da Fauna do Kimerridgiano da Mina de Lignito Guimarota (Leiria, Portugal). Serviços Geológicos de Portugal, Memória (Nova Série)","","22","","7","85","serial monograph","English",""
"62340","ref","auth,class","B.","Senowbari-Daryan","E.","Flügel","","1996","A ‘Problematic fossil’ revealed: Pycnoporidium ? eomesozoicum Flügel, 1972 (Late Triassic, Tethys) - not an enigmatic alga but a strophomenid brachiopod (Gosaukammerella n.g.)","Facies","","34","1","83","99","journal article","English","10.1007/BF02546158"
"6930","ref","auth,class","J. J.","Sepkoski, Jr.","","","","2002","A compendium of fossil marine animal genera","Bulletins of American Paleontology","","363","","1","560","serial monograph","English",""
"15484","ref","auth","D.","Sharpe","","","","1853","Descriptions of the new species of Zoophyta and Mollusca (appendix B to Ribeiro, Carlos, Carboniferous and Silurian formation of the neighborhood of Bussaco in Portugal)","Quarterly Journal of the Geological Society of London","","9","1","143","158","journal article","English",""
"54474","ref","auth","D.","Sharpe","","","","1849","On the Geology of the neighbourhood of Oporto, including the Silurian coal and slates of Valongo","Quarterly Journal of the Geological Society, London","","5","","142","153","journal article","English",""
"13499","ref","auth,class","A. B.","Shaw","","","","1957","Paleontology of Northwestern Vermont. VI. The early Middle Cambrian fauna","Journal of Paleontology","","31","4","785","792","journal article","",""
"49365","ref","auth,class","P.","Sheehan","","","","1977","Late Ordovician and Earliest Silurian Meristellid Brachiopods in Scandinavia","Journal of Paleontology","","51","1","23","43","journal article","English",""
"13695","ref","auth,class","P. M.","Sheehan","","","","1980","The Late Ordovician and Silurian of the Eastern Great Basin, Part 3. Brachiopods of the Tony Grove Lake Member of the Laketown Dolomite","Milwaukee Public Museum Contributions in Biology and Geology","","30","","1","23","journal article","",""
"13700","ref","auth,class","P. M.","Sheehan","","","","1982","Late Ordovician and Silurian of the eastern Great Basin Part 4. Late Llandovery and Wenlock brachiopods","Milwaukee Public Museum Contributions in Biology and Geology","","50","","1","73","journal article","English",""
"62132","ref","auth,class","P. M.","Sheehan","","","","1987","Late Ordovician (Ashgillian) brachiopods from the region of the Sambre and Meuse Rivers, Belgium","Bulletin-Institut royal des sciences naturelles de Belgique. Sciences de la terre","","57","","5","81","journal article","English",""
"13675","ref","auth,class","S.","Shen","Y.","Jin","","1999","Brachiopods from the Permian-Triassic boundary beds at the Selong Xishan section, Xizang (Tibet), China","Journal of Asian Earth Sciences","","17","","547","559","journal article","English",""
"24679","ref","auth,class","S. Z.","Shen","N. W.","Archbold","G. R. Shi, Z. Q. Chen","2000","Permian brachiopods from the Selong Xishan Section, Xizang (Tibet), China. Part 1: Stratigraphy, Strophomenida, Productida and Rhynchonellida","Geobios","","33","6","725","752","journal article","English",""
"24680","ref","auth,class","S. Z.","Shen","N. W.","Archbold","G. R. Shi, Z. Q. Chen","2001","Permian brachiopods from the Selong Xishan Section, Xizang (Tibet), China. Part 2: Palaeobiogeographical and palaeoecological implications, Spiriferida, Athyridida and Terebratulida","Geobios","","34","2","157","182","journal article","English",""
"30183","ref","auth,class","S. Z.","Shen","M. E.","Clapham","","2009","Wuchiapingian (Lopingian, Late Permian) brachiopods from the Episkopi Formation of Hydra Island, Greece","Palaeontology","","52","4","713","743","journal article","English",""
"37802","ref","auth","S. Z.","Shen","B. C.","Fan","C. Zhang, X. P. Zhang","1994","A new species of permianellids (Brachiopoda): taxonomic and palaeoecologic significance","Geobios","","27","4","477","485","journal article","English",""
"29971","ref","class","S. Z.","Shen","X. L.","He","G. R. Shi","1995","Biostratigraphy and correlation of several Permian-Triassic boundary sections in southwestern China","Journal of Southeast Asian Earth Sciences","","12","1-2","19","30","journal article","English",""
"30357","ref","auth,class","S. Z.","Shen","X. L.","He","M. L. Zhu","1992","Changxingian brachiopods from Zhongliang Hill of Chongqing, Sichuan Province","Stratigraphy and Palaeontology of Oil and Gas Bearing Areas in China","D. Y. Guo","3","","171","196","book/book chapter","Chinese",""
"30359","ref","class","S. Z.","Shen","X. L.","He","","1991","Changhsingian brachiopod assemblage sequence in Zhongliang Hill, Chongqing","Journal of Stratigraphy","","15","3","189","196","journal article","English",""
"33678","ref","auth,class","S. Z.","Shen","X. L.","He","","1994","Changhsingian brachiopod faunas from Guiding, Guizhou","Acta Palaeontologica Sinica","","33","","440","454","journal article","Chinese",""
"8371","ref","auth,class","S. Z.","Shen","G. R.","Shi","N. W. Archbold","2003","A Wuchiapingian (Late Permian) brachiopod fauna from an exotic block in the Indus-Tsangpo Suture Zone, southern Tibet, and its palaeobiogeographical and tectonic implications","Palaeontology","","46","2","225","256","journal article","English",""
"17736","ref","auth,class","S. Z.","Shen","G. R.","Shi","K. Y. Zhu","2000","Early Permian Brachiopods of Gondwana affinity from the Dingjiazhai Formation of the Baoshan Block, western Yunnan, China","Rivista Italiana di Paleontologia e Stratigrafia","","106","3","263","282","journal article","English",""
"18039","ref","auth,class","S. Z.","Shen","G. R.","Shi","Z. Fang","2002","Permian brachiopods from the Baoshan and Simao Blocks in Western Yunnan, China","Journal of Asian Earth Sciences","","20","","665","682","journal article","English",""
"32491","ref","auth,class","S. Z.","Shen","G. R.","Shi","","2007","Lopingian (Late Permian) brachiopods from South China. Part 1. Orthotetida, Orthida and Rhynchonellida","Bulletin of the Tohoku University Museum","","6","","1","102","journal article","English",""
"33679","ref","auth,class","S. Z.","Shen","G. R.","Shi","","2008","Latest Guadalupian brachiopods from the Guadalupian/Lopingian boundary GSSP section at Penglaitan in Laibin, Guangxi, south China and implications for the timing of the pre-Lopingian crisis","Palaeoworld","","18","","152","161","journal article","English",""
"33681","ref","auth,class","S. Z.","Shen","D. L.","Sun","G. R. Shi","2003","A biogeographically mixed late Guadalupian (late Middle Permian) brachiopod fauna from an exotic limestone block at Xiukang in Lhaze county, Tibet","Journal of Asian Earth Sciences","","21","","1125","1137","journal article","English",""
"60950","ref","auth,class","S. Z.","Shen","T. R.","Sun","Y. C. Zhang, D. X. Yuan","2016","An upper Kungurian/lower Guadalupian (Permian) brachiopod fauna from the South Qiangtang Block in Tibet and its palaeobiogeographical implications","Palaeoworld","","25","","519","538","journal article","English",""
"30362","ref","auth,class","S. Z.","Shen","J.","Tazawa","G. R. Shi","2005","Carboniferous and Permian Rugosochonetidae (Brachiopoda) from West Spitsbergen","Alcheringa","","29","","241","256","journal article","English",""
"36063","ref","class","S. Z.","Shen","J.","Tazawa","Y. Miyake","2011","A Kungurian (Early Permian) Panthalassan brachiopod fauna from Hatahoko in the Mino Belt, central Japan","Journal of Paleontology","","85","3","553","566","journal article","English",""
"29754","ref","auth,class","S. Z.","Shen","J. I.","Tazawa","G. R. Shi","1999","Peltichia Jin and Liao, 1981 (Enteletidae, Brachiopoda) from Asia: taxonomy, biostratigraphy, and paleobiogeography","Journal of Paleontology","","73","1","49","62","journal article","English",""
"33680","ref","class","S. Z.","Shen","J. I.","Tazawa","","1997","Two permianellids (Brachiopoda) from the Middle Permian of the southern Kitakami Mountains, northeast Japan","Paleontological Research","","1","","285","290","journal article","English",""
"53236","ref","class","S. Z.","Shen","J. I.","Tazawa","","2014","Pararigbyella and Dicystoconcha (Lyttoniidina, Brachiopoda) from the Middle Permian (Wordian) of Japan","Paleontological Research","","18","","245","249","journal article","English",""
"28322","ref","auth,class","S. Z.","Shen","Y. C.","Zhang","","2008","Earliest Wuchiapingian (Lopingian, Late Permian) brachiopods in southern Hunan, south China: implications for the pre-Lopingian crisis and onset of Lopingian recovery/radiation","Journal of Paleontology","","82","5","924","937","journal article","English",""
"11296","ref","auth,class","S.-Z.","Shen","N.W.","Archbold","G.R. Shi","2001","A Lopingian (Late Permian) brachiopod fauna from the Qubuerga Formation at Shengmi in the Mount Qomolangma Region of southern Xizang (Tibet), China","Journal of Paleontology","","75","2","274","283","journal article","",""
"13997","ref","auth,class","S.-Z.","Shen","T. A.","Grunt","Y.-G. Jin","2004","A comparative study of Comelicaniidae Merla, 1930 (Brachiopoda: Athyridida) from the Lopingian (Late Permian) of South China and Transcaucasia in Azerbaijan and Iran","Journal of Paleontology","","78","5","884","899","journal article","English",""
"17412","ref","auth,class","S.-Z.","Shen","G. R.","Shi","N. W. Archbold","2003","Lopingian (Late Permian) brachiopods from the Qubuerga Formation at the Qubu section in the Mt. Qomolangma region, southern Tibet (Xizang), China","Palaeontographica Abteilung A","","268","1-3","49","101","journal article","English",""
"16659","ref","auth,class","S.Z.","Shen","N.","Archbold","","2002","Chonetoidea (Brachiopoda) from the Lopingian (Late Permian) of South China","Alcheringa","","25","","327","349","journal article","English",""
"27695","ref","auth,class","G. R.","Shi","","","","1990","Replacement name for Antiquatonia sulcata Cooper, 1957 (Brachiopoda: Productoidea)","Journal of Paleontology","","64","3","490","","journal article","English",""
"34555","ref","auth","G. R.","Shi","","","","1993","N. W. Archbold. 1993. Systematic Palaeontology, in Aktastinian (Early Artinskian, Early Permian) brachiopods from the Jimba Jimba Calcarenite, Wooramel Group, Carnarvon Basin, Western Australia","Proceedings of the Royal Society of Victoria","","105","2","187","202","journal article","English",""
"37856","ref","auth,class","G. R.","Shi","","","","1998","Nahoniella, a new name for Yukonella Shi and Waterhouse, 1996 (Spiriferida, Brachiopoda)","Journal of Paleontology","","72","5","935","","journal article","English",""
"38290","ref","class","G. R.","Shi","","","","1994","The late Palaeozoic brachiopod genus Jakutoproductus Kashirtsev 1959 and the Jakutoproductus verchoyanicus Zone, northern Yukon Territory, Canada","Alcheringa","","18","","103","120","journal article","English",""
"38810","ref","class","G. R.","Shi","N. W.","Archbold","","1993","A compendium of Permian brachiopod faunas of the western Pacific region. 1. Asselian-Tastubian","Deakin University School of Aquatic Science and Natural Resources Management, Technical Papers","","1993","","1","68","serial monograph","English",""
"27601","ref","class","G. R.","Shi","N.W.","Archbold","","1995","Permian brachiopod faunal sequence of the Shan-Thai terrane: biostratigraphy, palaeobiogeographical affinities and plate tectonic/palaeoclimatic implications","Journal of Southeast Asian Earth Sciences","","11","3","177","187","journal article","English",""
"41204","ref","class","G. R.","Shi","Z. Q.","Chen","","2003","Global review of Permian Tyloplecta Muir-Wood and Cooper, 1960 (Brachiopoda): morphology, palaeobiogeographical and palaeogeographical implications","Gondwana Research","","6","","777","790","journal article","English",""
"62291","ref","auth,class","G. R.","Shi","Z.-Q.","Chen","L.-P. Zhan","2005","Early Carboniferous brachiopod faunas from the Baoshan block, west Yunnan,\r\nsouthwest China","Alcheringa","","29","1","31","85","journal article","English","10.1080/03115510508619560"
"27599","ref","auth,class","G. R.","Shi","Z.Q.","Chen","N.R. Hai","2002","Permophricodothyris Pavlova, 1965 (Brachiopoda, Spiriferida) from the Permian of south China: its morphology, biostratigraphy and distribution","Palaeontologische Zeitschrift","","76","2","369","383","journal article","English",""
"33689","ref","auth","G. R.","Shi","Z. J.","Fang","N. W. Archbold","1996","An Early Permian brachiopod fauna of Gondwanan affinity from the Baoshan block, western Yunnan, China","Alcheringa","","20","","81","101","journal article","English",""
"27811","ref","auth,class","G. R.","Shi","L.","Raksaskulwong","H. J. Campbell","2001","Early Permian brachiopods from central and northern peninsular Thailand","Carboniferous and Permian of the World. Canadian Society of Petroleum Geologists Memoir","","19","","596","608","journal article","English",""
"11134","ref","auth,class","G. R.","Shi","S.","Shen","","2001","A biogeographically mixed, Middle Permian brachiopod fauna from the Baoshan Block, western Yunnan, China","Palaeontology","","44","2","237","258","journal article","",""
"13706","ref","auth,class","G. R.","Shi","S.","Shen","L. Zhan","2003","A Guadalupian-Lopingian (Middle to Late Permian) brachiopod fauna from the Juripu Formation in the Yarlung-Zangbo suture zone, southern Tibet, China","Journal of Paleontology","","77","6","1053","1068","journal article","English",""
"13956","ref","auth,class","G. R.","Shi","S.","Shen","J.-I. Tazawa","2002","Middle Permian (Guadalupian) brachiopods from the Xiujimqinqi area, Inner Mongolia, northeast China, and their palaeobiogeographical and palaeogeographical significance","Paleontological Research","","6","3","285","297","journal article","English",""
"42543","ref","auth,class","G. R.","Shi","S. Z.","Shen","H. J. Campbell, L. Raksaskulwong","2001","A Meekella-dominated Early Permian brachiopod assemblage from central Peninsular Thailand","Contributions to the Geology and Palaeontology of Gondwana in Honour of Helmut Wopfner","","","","441","451","book/book chapter","English",""
"17750","ref","auth,class","G. R.","Shi","S.-Z.","Shen","","1997","A Late Permian brachiopod fauna from Selong, Southern Xizang (Tibet), China","Proceedings of the Royal Society of Victoria","","109","1","37","56","journal article","English",""
"27361","ref","auth,class","G. R.","Shi","S.Z.","Shen","N.W. Archbold","1999","Gruntea gen. nov. a new Permian spirigerellid (Brachiopoda) genus from Selong, southern Tibet, China","Acta Palaeontologica Sinica","","38","","346","352","journal article","English",""
"11356","ref","class","G. R.","Shi","J.","Tazawa","","2001","Rhynchopora and Blasispirifer (Brachiopoda) from the Middle Permian of the Hida Gaien Belt, central Japan, and their paleobiogeographical significance","Journal of Geological Society of Japan","","107","12","755","761","journal article","",""
"33688","ref","auth,class","G. R.","Shi","J. B.","Waterhouse","","1991","Early Permian brachiopods from Perak, west Malaysia","Journal of Southeast Asian Earth Sciences","","6","","25","39","journal article","English",""
"27298","ref","auth,class","G. R.","Shi","J.B.","Waterhouse","","1996","Lower Permian brachiopods and molluscs from the upper Jungle Creek Formation, northern Yukon Territory, Canada","Geological Survey of Canada Bulletin","","424","","1","241","serial monograph","English",""
"33914","ref","auth,class","X.","Shi","R. E.","Grant","","1993","Jurassic rhynchonellids: internal structures and taxonomic revisions","Smithsonian Contributions to Paleobiology","","73","","1","190","journal article","English",""
"32975","ref","auth,class","Y.","Shiino","","","","2009","Middle Permian echinoconchoide brachiopod Vediproductus in the Kamiyasse area, Southern Kitakami Mountains, northeast Japan","Paleontological Research","","13","3","251","258","journal article","English",""
"37863","ref","class","Y.","Shiino","Y.","Suzuki","","2007","Articulatory and musculatory systems in a Permian concavo-convex brachiopod Waagenoconcha imperfecta Prendergast, 1935 (Productida, Brachiopoda)","Paleontological Research","","11","3","265","275","journal article","English",""
"16338","ref","auth,class","H. W.","Shimer","R. R.","Shrock","","1944","","Index fossils of North America","","","","1","837","book/book chapter","English",""
"27797","ref","class","D.","Shimizu","","","","1981","Upper Permian brachiopod fossils from Guryul Ravine and the spur three kilometres north of Barus","The Upper Permian and Lower Triassic faunas of Kashmir. Palaeontologia Indica New Series","","46","","66","85","book/book chapter","English",""
"33691","ref","auth,class","D.","Shimizu","","","","1961","Brachiopod fossils from the Permian Maizuru Group","Memoirs of the College of Science, University of Kyoto, Series B","","27","","309","351","journal article","English",""
"44305","ref","auth,class","T.","Shintani","","","","2011","Orthotetoids from the Lower Permian (Sakmarian) of the Nagaiwa-Sakamotozawa area, South Kitakami Belt, northeast Japan","Science Reports, Niigata University (Geology)","","26","","73","90","journal article","English",""
"17105","ref","auth,class","B. F.","Shumard","","","","1859","Notice of fossils from the Permian strata of Texas and New Mexico obtained by the United States expedition under Capt. John Pope, for boring artesian wells along the 32nd parallel, with descriptions of new species from these strata and the Coal Measures of that region","Transactions of the Academy of Science of St. Louis","","1","","387","402","journal article","English",""
"36929","ref","auth","B. F.","Shumard","","","","1858","Notice of new fossils from the Permian strata of New Mexico and Texas, collected by Dr. George G. Shumard, geologist of the United States Government expedition for obtaining water by means of artesian wells along the 32nd parallel, under the direction of Capt John Pope, US Corps Topographic Engineers","Transactions of the Academy of Science of St. Louis","","1","","290","297","journal article","English",""
"22354","ref","auth","B. F.","Shumard","","","","1855","Description of new species of organic remains","Missouri Geological Survey","","2","","185","208","journal article","English",""
"16340","ref","auth","B. F.","Shumard","G.C.","Swallow","","1858","Descriptions of new fossils from the Coal Measures of Missouri and Kansas","Academy of Science of St. Louis Transactions","","1","","198","227","journal article","English",""
"7633","ref","auth,class","M.","Siblik","","","","1998","A contribution to the brachiopod fauna of the ""Oberrhaetkalk"" (Northern Calcareous Alps, Tyrol-Salzburg)","Jahrbuch der geologischen Bundesanstalt","","141","1","73","95","journal article","English",""
"7634","ref","auth,class","M.","Siblik","","","","1999","New data on the Hettangian brachiopod fauna of the Northern Calcareous Alps (Austria, Bavaria)","Abhandlungen der geologischen Bundesanstalt","","56","2","419","438","journal article","",""
"7635","ref","auth,class","M.","Siblik","","","","1993","Lower Liassic brachiopods from the Steinplatte-Kammerkoehral area near Waidring (Northern Calcareous Alps, Salzburg)","Jahrbuch der geologischen Bundesanstalt","","136","4","965","982","journal article","",""
"13224","ref","auth,class","M.","Siblik","","","","1999","On Carnian brachiopods of the Gaisberg near Kirchberg in Tirol (Northern Calcareous Alps, Tyrol)","Abhandlungen der geologischen Bundesanstalt","","56","2","113","120","","",""
"13251","ref","class","M.","Siblik","","","","1971","Anisian rhynchonellids from the Slovak Karst region","Geologicke Prace, Spravy","","56","","163","184","journal article","",""
"31802","ref","auth,class","M.","Siblík","","","","1991","Triassic brachiopods from Ahgdarband (NE-Iran)","Abhandlungen der Geologischen Bundesanstalt","","38","","165","174","journal article","English",""
"35850","ref","auth,class","M.","Siblik","","","","1975","Triassic brachiopods from Nepal","Rivista Italiana di Paleontologia e Stratigrafia","","81","2","133","160","journal article","English",""
"50809","ref","auth,class","M.","Siblík","","","","1999","Brachiopod taxonomy, in Carnian reef biota from a megabreccia of the Hawasina complex (Al Aqil, Oman)","Rivista Italiana di Paleontologia e Stratigrafia","","105","3","327","342","journal article","English",""
"51997","ref","auth,class","M.","Siblik","","","","1967","New Species of Domerian Rhynchonelloids From Slovakia","Geologicky Sbornik","","18","1","151","167","journal article","English",""
