"Data Provider","The Paleobiology Database"
"42368","ref","auth,class","B. K.","Likharev","","","","1934","Nekotorykh novykh rodakh Verkhnepaleozoyskikh brakhiopod [On some new genera of upper Palaeozoic Brachiopoda]","Doklady Akademii Nauk SSSR","","1","4","210","213","journal article","Russian",""
"63389","ref","auth,class","M.","Liljeroth","D. A. T.","Harper","H. Carlisle, A. T. Nielsen","2017","Ordovician rhynchonelliformean brachiopods from Co. Waterford, SE Ireland: Palaeobiogeography of the Leinster Terrane","Fossils and Strata","","","62","1","164","journal article","English","10.111/let.12205"
"12782","ref","auth","C.","Linnaeus","","","","1758","","Systema Naturae per Regna Tria Naturae, Secundum Classes, Ordines, Genera, Species, cum Characteribus, Differentiis, Synonymis, Locis. Editio Decima","","1","","1","824","book","other","10.5962/bhl.title.542"
"21570","ref","auth","C.","Linnaeus","","","","1767","","Systema Naturae per Regna Tria Naturae, Secundum Classes, Ordines, Genera, Species, cum Characteribus, Differentiis, Synonymis, Locis. Editio Duodecima","","1","2","533","1327","book","other",""
"16148","ref","auth,class","J.","Lintz","L.S.","Lohr","","1958","Two new invertebrates from the Mississippian of Nevada","Journal of Paleontology","","32","5","977","980","journal article","English",""
"33593","ref","auth,class","F.","Liu","J. B.","Waterhouse","","1985","Permian strata and brachiopods from Xiujimqinqi region of Neimongol (Inner Mongolia) autonomous region, China","Papers - Department of Geology, University of Queensland","","11","2","1","44","journal article","English",""
"53403","ref","auth,class","S. V.","Lobacheva","","","","1974","New genus of Hauterivian Dallinidae (Brachiopoda)","Paleontologicheskiy Zhurnal","","1974","3","146","149","journal article","Russian",""
"53425","ref","auth,class","S. V.","Lobacheva","","","","1983","On Berriasian brachiopods of Crimea","Annual of All-Soviet Palaeontology Society","","26","","184","206","journal article","Russian",""
"53473","ref","auth,class","S. V.","Lobacheva","","","","2007","Early Cretaceous terebratulids of the subfamily Platythyridinae (Brachiopoda) of Crimea and Middle Asia","Questions of Stratigraphy, Palaeontology and Palaeogeography (In Memory of 100 Anniversary of Professor G. Ya. Krymholz)","","","","118","127","journal article","Russian",""
"12532","ref","auth,class","S. V.","Lobatscheva","","","T.N. Smirnova","1994","A new brachiopod genus of the family Ochotorhynchiidae from the Lower Cretaceous of the Crimea","Paleontological Journal (Paleontologicheskii zhurnal)","","28","3","165","171","journal article","English",""
"13452","ref","class","C.","Lochman","","","","1966","Lower Ordovician (Arenig) faunas from the Williston Basin, Montana and North Dakota","Journal of Paleontology","","40","3","512","548","journal article","",""
"16150","ref","auth,class","C.","Lochman","","","","1956","Stratigraphy, paleontology, and paleogeography of the Elliptocephala asaphoides strata in Cambridge and Hoosick quadrangles, New York","Geological Society of America Bulletin","","67","","1331","1396","journal article","English",""
"62256","ref","auth,class","M. G.","Lockley","A.","Williams","","1981","1981. Lower Ordovician Brachiopoda from mid and southwest Wales","Bulletin of the British Museum (Natural History) Geology Series","","34","","1","78","journal article","English",""
"32490","ref","auth,class","A.","Logan","","","","1963","The new brachiopod genus Howseia from the Permian Magnesian Limestone of Durham","Palaeontology","","6","4","754","761","journal article","English",""
"29688","ref","auth,class","A.","Logan","A.","McGugan","","1968","Biostratigraphy and faunas of the Permian Ishbel Group, Canadian Rocky Mountains","Journal of Paleontology","","42","5","1123","1139","journal article","English",""
"34910","ref","auth,class","T. C.","Lu","","","","1978","Brachiopod taxonomic names","Palaeontological Atlas of Southwest China - Sichuan Volume","","2","","233","262","book/book chapter","Chinese",""
"35766","ref","auth,class","T. C.","Lu","","","","1982","Early Permian brachiopods from Gaoqiao, Mianchu, Sichuan Province","Acta Palaeontologica Sinica","","21","5","607","612","journal article","Chinese",""
"55495","ref","auth,class","A.","Lukeneder","","","","2002","Shell accumulation of the brachiopod Pygope catulloi Pictet, 1867 (Lower Valanginian; Northern Calcareous Alps, Upper Austria): palaeoecological implications","Annalen des Naturhistorischen Museums in Wien, Serie A","","103","","143","159","journal article","English",""
"30248","ref","auth,class","H.-L.","Luo","L.","Yong","S.-X. Hu, X.-P. Fu, S.-Q. Hou, X.-Y. Liu, L.-Z. Chen, F.-J. Li, J.-Y. Pang, Q. Liu.","2008","","Early Cambrian Malong Fauna and Guanshan Fauna from Eastern Yunnan, China","","","","1","134","book/book chapter","Chinese",""
"13442","ref","auth","F.","M'Coy","","","","1844","","A synopsis of the characters of the Carboniferous limestone fossils of Ireland","","","","1","274","book/book chapter","English",""
"36909","ref","auth,class","F.","M'Coy","","","","1846","","A synopsis of the characters of the Silurian fossils of Ireland: collected from several districts by Richard Griffith","","","","1","72","book/book chapter","English",""
"21658","ref","auth,class","F.","M'Coy","","","","1847","XXI. On the fossil botany and zoology of the rocks associated with the coal of Australia","Annals and Magazine of Natural History","","20","133","226","236","journal article","English",""
"30408","ref","auth,class","X.","Ma","V.","Ebbighausen","R. T. Becker","2008","Desquamatia and related atrypid brachiopods from the Frasnian (Upper Devonian) of Bergisches Land, Germany","Canadian Journal of Earth Sciences","","45","","121","134","journal article","English",""
"43142","ref","auth,class","D. A. B.","MacFarlan","","","","1992","Triassic and Jurassic Rhynchonellacea (Brachiopoda) from New Zealand and New Caledonia","Royal Society of New Zealand Bulletin","","31","","1","310","serial monograph","English",""
"60902","ref","auth,class","D. A. B.","MacFarlan","","","","2016","Middle and Late Jurassic terebratulides from New Zealand","Palaeoworld","","25","","467","495","journal article","English",""
"28535","ref","auth,class","D. A. B.","MacFarlan","J. D.","Campbell","","2003","Zeilleria spiculata, a new terebratulide brachiopod from the latest Triassic-earliest Jurassic of New Zealand","Journal of the Royal Society of New Zealand","","33","1","213","221","journal article","English",""
"49035","ref","auth,class","D.","MacKinnon","","","","1993","Systematic Paleontology, in Brachiopod fauna of the Kokoamu Greensand (Oligocene), New Zealand","New Zealand Journal of Geology and Geophysics","","36","","327","347","journal article","English",""
"49032","ref","auth,class","D.","MacKinnon","S. S.","Beus","D.L. Lee","1993","Brachiopod fauna of the Kokoamu Greensand (Oligocene), New Zealand","New Zealand Journal of Geology and Geophysics","","36","","327","347","journal article","English",""
"18900","ref","auth,class","D. I.","MacKinnon","T. N.","Smirnova","","1995","Scanning electron microscopy study of Cretaceous brachiopods of the new family Praeargyrothecidae: implications for megathyroid systematics and terebratulide phylogeny","Journal of Paleontology","","69","4","670","685","journal article","English",""
"6112","ref","auth","R. W.","Macomber","","","","1970","Articulate Brachiopods from the Upper Bighorn Formation (Late Ordovician) of Wyoming","Journal of Paleontology","","44","3","416","450","journal article","",""
"62391","ref","auth,class","A. A.","Madison","","","","2013","New Brachiopod Subfamily Anechophragmiinae (Strophomenida) from the Ordovician of the Leningrad Region","Paleontological Journal","","47","1","23","35","journal article","English","10.1134/S0031030113010061"
"63132","ref","auth,class","A. A.","Madison","","","","2017","To the Revision of the Upper Ordovician Bilobia Cooper (Strophomenida, Brachiopoda)","Paleontological Journal","","51","4","368","373","journal article","English","10.1134/S0031030117040062"
"55412","ref","auth,class","V. P.","Makridin","","","","1964","","Brakhiopody Yurskikh Otlozheniy Russkoy Platformy i Nekotorykh Prilezhashchikh k Ney Oblastey","","","","1","390","book","Russian",""
"33595","ref","auth,class","I. N.","Manankov","","","","1998","Late Permian Productida (Brachiopoda) from southeastern Mongolia","Paleontological Journal","","32","","486","492","journal article","English",""
"33596","ref","auth,class","I. N.","Manankov","","","","2008","Mongousia: a new productid genus (Brachiopoda) from the Permian of northeastern Mongolia","Paleontological Journal","","42","","265","268","journal article","English",""
"37468","ref","auth,class","I. N.","Manankov","","","","1991","Productidina descriptions","Permian Invertebrates of Southern Mongolia","","","","101","120","book/book chapter","Russian",""
"38731","ref","auth,class","I. N.","Manankov","","","","1992","Novye Produktidy iz Verkhnepermskikh otlozhenii severo-vostochnoi Mongolii","Novye Taksony Iskopaemykh Bespozvonochnykh Mongolii, Sovmestnaya Rossiisko-Mongol'skaya Paleontologicheskaya Ekspeditsiya","","4","","70","75","book/book chapter","Russian",""
"27329","ref","auth,class","I.N.","Manankov","","","","2004","New species of Early Permian brachiopods and biostratigraphy of the boreal basin of Mongolia","Paleontological Journal","","38","4","366","372","journal article","English",""
"42738","ref","auth,class","M. O.","Manceñido","","","","2012","Phylum Brachiopoda, in Late Triassic bivalves and brachiopods from southern Mendoza, Argentina","Revue de Paléobiologie, Genève, Vol. spéc","","11","","331","333","journal article","English",""
"52066","ref","auth,class","M. O.","Mancenido","","","","1993","Early Jurassic brachiopods From Greece: a review","Mesozoic Brachiopods of Alpine Europe","J. Palfy, A. Voros","","","79","100","book/book chapter","English",""
"52302","ref","auth,class","M. O.","Mancenido","","","","1993","First record of Jurassic nucleatid brachiopods from the southwest Pacific with comments on the global distribution of the group","Palaeogeography, Palaeoclimatology, Palaeoecology","","100","","189","207","journal article","English",""
"34335","ref","auth,class","M. O.","Mancenido","C. D.","Walley","","1979","Functional morphology and ontogenetic variation in the Callovian brachiopod Septirhynchia from Tunisia","Palaeontology","","22","2","317","337","journal article","English",""
"47204","ref","auth","H.","Mansuy","","","","1915","Faunes Cambriennes du Haut-Tonkin","Mémoires du Service Géologique de l’Indochine","","4","","1","35","journal article","French",""
"28496","ref","auth","J.","Marcou","","","","1858","","Geology of North America with two reports on the Prairies of Arkansas and Texas, the Rocky Mountains of New Mexico, and the Sierra Nevada of California","","","","1","144","journal article","English",""
"47779","ref","auth,class","L.","Marek","V.","Havlíek","","1967","The articulate brachiopods of the Kosov Formation (upper Ashgillian)","Vestník Ústredního ústavu geologického","","42","4","275","284","journal article","English",""
"24132","ref","class","G. C.","Martin","","","","1904","Brachiopoda","Maryland Geological Survey","","Miocene","Text","402","403","journal article","English",""
"42749","ref","auth","K.","Martin","","","","1881","Die versteinerungsführenden Sedimente Timors","Sammlungen Geologischen Reichsmuseums in Leiden, Series 1","","1","","1","64","journal article","German",""
"57245","ref","class","M. L.","Martínez Chacón","","","","1979","Braquiópodos carboníferos de la Cordillera Cantábrica (Orthida, Strophomenida y Rhynchonellida)","Madrid, Instituto Geológico y Minero de España, Memorias","","96","","1","291","serial monograph","Spanish",""
"54309","ref","auth","K. F.","Mather","","","","1917","The Trenton fauna of Wolfe Island, Ontario","Ottawa Naturalist","","31","","33","40","journal article","English",""
"21630","ref","auth","K.F.","Mather","","","","1915","The fauna of the Morrow Group of Arkansas and Oklahoma","Bulletin of the Scientific Laboratories of Denison University","","18","3","59","284","journal article","English",""
"15517","ref","auth","G. F.","Matthew","","","","1902","Notes on Cambrian faunas","Royal Society of Canada, Transactions (ser.2, sect. 4)","","8","","93","112","journal article","English",""
"26490","ref","auth","G. F.","Matthew","","","","1891","Illustrations of the fauna of the St. John Group, No. 5","Transactions of the Royal Society of Canada (Series 1, Section 4)","","8","","123","166","journal article","English",""
"34343","ref","auth,class","S. C.","Matthews","","","","1973","Lapworthellids from the Lower Cambrian Strenuella Limestone at Comley, Shropshire","Palaeontology","","16","1","139","148","journal article","English",""
"26958","ref","auth","C. J.","Maury","","","","1912","A contribution to the paleontology of Trinidad","Journal of the Academy of Natural Sciences of Philadelphia","","15","","1","112","serial monograph","English",""
"26800","ref","auth,class","W. G. H.","Maxwell","","","","1964","The geology of the Yarrol Region. Part 1. Biostratigraphy","Papers - Department of Geology, University of Queensland","","5","9","1","60","serial monograph","English",""
"26717","ref","auth","W.G.H.","Maxwell","","","","1954","Strophalosia in the Permian of Queensland","Journal of Paleontology","","28","5","535","559","journal article","English",""
"17286","ref","class","A.","May","","","","2003","Die Fossilführung des Mitteldevons im Raum Attendorn-Olpe (West-Sauerland; Rechtsrheinisches Schiefergebirge) [Middle Devonian fossils of the Attendorn-Olpe area (western Sauerland; Rhenish Massif]","Geologie und Paläontologie in Westfalen","","60","","47","79","journal article","German",""
"16172","ref","auth,class","A. M.","McChesney","","","","1859","Descriptions of new species of fossils from the Paleozoic rocks of the western states","Transactions of the Chicago Academy of Sciences","","1","","1","76","journal article","English",""
"36711","ref","auth,class","G.","McClung","","","","1978","Morphology, palaeocology and biostratigraphy of Ingelarella (Brachiopoda : Spiriferida) in the Bowen and Sydney Basins of Eastern Australia","Geological Survey of Queensland Publication","","365","","17","87","journal article","English",""
"27930","ref","auth,class","G.","McClung","J.","Armstrong","","1978","Species of Glendonia gen. nov. (Ingelarellinae: Spiriferida) in the Permian of eastern Australia","Geological Survey of Queensland Publication","","365","","1","5","journal article","English",""
"33598","ref","auth","G.","McClung","J.","Armstrong","","1975","New species of Martiniopsis (Brachiopoda: Spiriferida) from the Permian of eastern Australia","Queensland Government Mining Journal","","76","","231","234","journal article","English",""
"24541","ref","auth","F.","McCoy","","","","1851","","In Sedgwick A. & McCoy F. 1851-1857. A systematic description of the British Palaeozoic fossils in the geological Museum of the University of Cambridge. London and Cambridge","","","","1","611","book/book chapter","English",""
"53203","ref","auth,class","E. D.","McEwan","","","","1919","A study of the brachiopod genus Platystrophia","Proceedings of the United State National Museum","","56","","383","448","journal article","English",""
"53433","ref","auth,class","M. J.","McIntosh","","","","1974","Some Scottish Carboniferous brachiopods","Scottish Journal of Geology","","10","","199","222","journal article","English",""
"47686","ref","auth,class","E. D.","McKee","","","","1941","Derbya arizonensis, new name for D. regularis McKee","Journal of Paleontology","","15","","91","","journal article","English",""
"21651","ref","auth","E. D.","McKee","","","","1938","The environment and history of the Toroweap and Kaibab Formations of northern Arizona and southern Utah","Carnegie Institution of Washington Publication","","492","","1","268","serial monograph","English",""
"53206","ref","auth,class","F. H.","McLearn","","","","1918","The Silurian Arisaig Series of Arisaig, Nova Scotia","American Journal of Science","","45","","126","140","journal article","English",""
"11466","ref","auth,class","F. B.","Meek","","","","1873","Descriptions of the invertebrate fossils of the Silurian and Devonian systems","Geological Survey of Ohio","","1","2","1","243","serial monograph","",""
"46305","ref","auth","F. B.","Meek","","","","1860","Descriptions of new fossil remains collected in Nebraska and Utah, by the exploring expeditions under the command of Capt. J. H. Simpson, of U. S. Topographical Engineers","Proceedings of the Academy of Natural Sciences of Philadelphia","","12","","308","315","journal article","English",""
"46737","ref","auth","F. B.","Meek","","","","1868","Remarks on the geology of the valley of Mackenzie River with figures and descriptions of fossils from that region in the museum of the Smithsonian Institution, principally collected by the late Robert Kennicott, Esq","Chicago Academy of Sciences, Transactions","","1","3","61","114","journal article","English",""
"16190","ref","auth","F. B.","Meek","","","","1877","Part I. Palaeontology","Report of the Geological Exploration of the Fortieth Parallel","","4","","1","197","journal article","English",""
"21674","ref","auth","F. B.","Meek","","","","1872","Report on the paleontology of eastern Nebraska with some remarks on the Carboniferous rocks of that district","U. S. 42nd Congress, 1st session, House Ex. Document","","19","","83","264","journal article","English",""
"21677","ref","auth","F. B.","Meek","","","","1873","Lists of fossils collected","Sixth Annual Report of the U.S. Geological Survey of the territories, embracing portions of Montana, Idaho, Wyoming and Utah","","","","463","478","book/book chapter","English",""
"16178","ref","auth","F. B.","Meek","F.V.","Hayden","","1858","Remarks oon the Lower Cretaceous beds of Kansas and Nebraska, together with descriptions of some new species of Carboniferous fossils from the valley of Kansas River","Proceedings of the Academy of Natural Sciences, Philadelphia","","1858","","256","264","journal article","English",""
"16183","ref","auth","F. B.","Meek","A. H.","Worthen","","1868","Part II. Palaeontology","Geological Survey of Illinois","","3","","291","565","journal article","English",""
"16185","ref","auth","F. B.","Meek","A. H.","Worthen","","1873","Descriptions of invertebrates from the Carboniferous System","Illinois Geological Survey","","5","2","321","619","journal article","English",""
"31692","ref","auth","D.","Mehl","F. T.","Fürsich","","1997","Middle Jurassic Porifera from Kachchh, western India","Palaeontologische Zeitschrift","","71","","19","33","journal article","English",""
"54437","ref","auth","M. A.","Melou","","","","1985","Révision d'""Orthis"" berthoisi Rouault, 1849 Orchid (Brachiopoda) de l'Ordovicien du Massif Armoricain","Geobios","","18","5","595","603","journal article","English",""
"48609","ref","auth,class","M.","Mergl","","","","2012","Lingulate and craniate brachiopods from the top of the Králv Dvr Formation (latest Katian) and their contribution to palaeogeography","borník Národního muzea. ada B, Pírodní vdy","","68","1/2","35","46","journal article","English",""
"49751","ref","auth,class","M.","Mergl","V.","Kordule","","2008","New Middle Cambrian lingulate brachiopods from the Skryje-Tyovice area (Central Bohemia, Czech Republic)","Bulletin of Geosciences","","83","1","11","22","journal article","English","10.3140/bull.geosci.2008.01011"
"9606","ref","auth,class","M.","Mergl","D.","Massa","","1992","Devonian and Lower Carboniferous brachiopods and bivalves from western Libya","Biostratigraphie du Paleozoique","","12","","1","115","serial monograph","",""
"49759","ref","auth,class","M.","Mergl","P.","Slehoferová","","1990","Middle Cambrian inarticulate brachiopods from Central Bohemia","Sborník geologickych vd, Paleontologie","","31","","9","46","journal article","English",""
"53858","ref","auth","C. W.","Merriam","","","","1940","Devonian stratigraphy and paleontology of the Roberts Mountains Region, Nevada","Geological Society of America Special Papers","","25","","1","110","journal article","English","10.1130/SPE25-p1"
"18892","ref","auth,class","F. A.","Middlemiss","","","","1959","English Aptian Terebratulidae","Palaeontology","","2","1","94","142","journal article","English",""
"19008","ref","auth,class","F. A.","Middlemiss","","","","1980","Lower Cretaceous Terebratulidae from south-western Morocco and their biogeography","Palaeontology","","23","3","515","556","journal article","English",""
"49761","ref","auth,class","F. A.","Middlemiss","","","","1978","The genus Platythyris (Brachiopoda) and its relationship to the Pygopidae","Palaeontologische Zeitschrift","","52","1/2","28","46","journal article","English",""
"49779","ref","auth,class","F. A.","Middlemiss","","","","1983","Brachiopod synonymy: Glosseudesia and Costithyris","Eclogae Geologicae Helvetiae","","76","3","689","689","journal article","English",""
"49780","ref","auth,class","F. A.","Middlemiss","","","","1983","Lower Cretaceous Terebratulidae of the Jura region. Part 2, The Aptian fauna of La Presta and Noirvaux Dessus and the Upper Albian Fauna of La Vraconne","Eclogae Geologicae Helvetiae","","76","3","669","687","journal article","English",""
"49791","ref","auth,class","F. A.","Middlemiss","","","","1984","Lower Cretaceous Terebratulidae of the Jura region. Part 3, Terebratula salevensis de Loriol and the genera Praelongithyris and Tropeothyris","Eclogae Geologicae Helvetiae","","77","3","583","617","journal article","English",""
"54036","ref","auth,class","F. A.","Middlemiss","","","","1968","Brachiopodes Du Cretace Inferieur Des Corbieres Orientales (Aude)","Annales de Paléontologie","","54","2","171","204","journal article","French",""
"16195","ref","class","S. A.","Miller","","","","1877","","The American Palaeozoic fossils: a catologue of the genera and species.  2nd ed.","","","","1","293","book/book chapter","English",""
"16196","ref","class","S. A.","Miller","","","","1891","Palaeontology","Advanced sheets to the Indiana Department of Geology and Natural Resources Annual Report","","17","","1","95","book/book chapter","English",""
"21744","ref","auth","S. A.","Miller","","","","1883","","The American Palaeozoic fossils: a catalogue of the genera and species, with names of authors, dates, places of publication, groups of books in which found, and the etymology and signifcation of the words, and an introduction devoted to the stratigraphical geology of the Palaeozoic rocks","","","","247","334","book/book chapter","English",""
"10478","ref","auth,class","P. C.","Mills","R. L.","Langenheim Jr.","","1987","Wolfcampian brachiopods from the Bird Spring Group, Wamp Spring area, Las Vegas Range, Clark County, Nevada","Journal of Paleontology","","61","1","32","55","journal article","English",""
"21771","ref","auth","M.","Minato","","","","1951","On the Lower Carboniferous fossils of the Kitakami Massif, NE Honsyu, Japan","Journal of the Faculty of Science, Hokkaido University, ser. 4","","7","","355","382","journal article","English",""
"32677","ref","auth","V. V.","Missarzhevsky","","","","1970","New generic name Tommotia, nom. nov.","Paleontological Journal","","1970","2","100","100","journal article","Russian",""
"34137","ref","auth,class","V. V.","Missarzhevsky","A. M.","Mambetov","","1981","Stratigrafiya i fauna pogranichnykh sloyev Kembriya i Dokembriya Malogo Karatau [Stratigraphy and fauna of the Precambrian-Cambrian boundary beds of the Malyy Karatau]","Trudy Ordena Trudovogo Krasnogo Znameni Geologicheskiy Institut Akademiya NAUK SSSR","","326","","1","90","serial monograph","Russian",""
"53007","ref","auth,class","W. I.","Mitchell","","","","1977","The Ordovician Brachiopoda from Pomeroy, Co. Tyrone","The Palaeontographical Society Monographs","","130","545","1","138","serial monograph","English",""
"55493","ref","auth,class","T. L.","Modzalevskaya","","","","2007","The earliest terebratulids","Palaeontology","","50","4","869","882","journal article","English","10.1111/j.1475-4983.2007.00680.x"
"62369","ref","auth,class","T. L.","Modzalevskaya","","","","2003","Silurian and Devonian brachiopods from Severnaya Zemlya (Russian Arctic)","Geodiversitas","","25","1","73","107","journal article","English",""
"48558","ref","auth,class","T. L.","Modzalevskaya","L. E.","Popov","","1995","Earliest Silurian articulate brachiopods from central Kazakhstan","Acta Palaeontologica Polonica","","40","4","399","426","journal article","English",""
"42841","ref","auth,class","A. S.","Moisseiev","","","","1932","O faune i flore Triasovykh otlozheniy doliny reki Salgir v Krymu [On the flora and fauna of the Triassic deposits in the valley of Salghir River, Crimea]","Izvestiya Vsesoyuznogo Geologo-Razvedochnogo Obedineniya","","51","39","591","604","journal article","Russian",""
"57177","ref","auth","R. C.","Moore","","","","1964","Paleoecological Aspects of Kansas Pennsylvanian and Permian Cyclothems","Bulletin of the Kansas Geological Survey","D.F. Merriam","169","","287","380","journal article","English",""
"16202","ref","auth,class","H.","Morningstar","","","","1922","Pottsville fauna of Ohio","Ohio Geological Survey Bulletin","","25","","1","312","journal article","English",""
"37248","ref","auth,class","J.","Morris","","","","1845","Descriptions of fossils, Mollusca","Physical descriptions of New South Wales and Van Diemen’s Land","P. E. de Strzelecki","","","270","290","book/book chapter","English",""
